id	unicode_word	translit	pronunciation	full_definition
G1437	ἐάν	eán	eh-an'	from G1487 and G302 ; def: a conditional particle; in case that, provided, etc.; often used in connection with other particles to denote indefiniteness or uncertainty kjv:--before, but, except, (and) if, (if) so, (what-, whither-)soever, though, when (-soever), whether (or), to whom, (who-)so(-ever). see G1487, see G302, see G3361,
G1438	ἑαυτοῦ	heautoû	heh-ow-too'	from a reflexive pronoun otherwise obsolete and the genitive case (dative case or accusative case) of G846 ; def: him- (her-, it-, them-, also (in conjunction with the personal pronoun of the other persons) my-, thy-, our-, your-) self (selves), etc. kjv:--alone, her (own, -self), (he) himself, his (own), itself, one (to) another, our (thine) own(-selves), + that she had, their (own, own selves), (of) them(-selves), they, thyself, you, your (own, own conceits, own selves, -selves). see G846,
G1439	ἐάω	eáō	eh-ah'-o	of uncertain affinity; def: to let be, i.e. permit or leave alone kjv:--commit, leave, let (alone), suffer. see G1436,
G1440	ἑβδομήκοντα	hebdomḗkonta	heb-dom-ay'-kon-tah	from G1442 and a modified form of G1176 ; def: seventy kjv:--seventy, three score and ten. see G1442, see G1176,
G1441	ἑβδομηκοντάκις	hebdomēkontákis	heb-dom-ay-kon-tak-is	multiple adverb from G1440 ; def: seventy times kjv:--seventy times. see G1440,
G1442	ἕβδομος	hébdomos	heb'-dom-os	ordinal from G2033 ; def: seventh kjv:--seventh. see G2033,
G1443	Ἐβέρ	Ebér	eb-er'	of Hebrew origin ( H05677 ); def: Eber, a patriarch kjv:--Eber. see H05677,
G1444	Ἑβραϊκός	Hebraïkós	heb-rah-ee-kos'	from G1443 ; def: Hebraic or the Jewish language kjv:--Hebrew. see G1443,
G1445	Ἑβραῖος	Hebraîos	heb-rah'-yos	from G1443 ; def: a Hebræan (i.e. Hebrew) or Jew kjv:--Hebrew. see G1443,
G1446	Ἑβραΐς	Hebraḯs	heb-rah-is'	from G1443 ; def: the Hebraistic (Hebrew) or Jewish (Chaldee) language kjv:--Hebrew. see G1443,
G1447	Ἑβραϊστί	Hebraïstí	heb-rah-is-tee'	adverb from G1446 ; def: Hebraistically or in the Jewish (Chaldee) language kjv:--in (the) Hebrew (tongue). see G1446,
G1448	ἐγγίζω	engízō	eng-id'-zo	from G1451 ; def: to make near, i.e. (reflexively) approach kjv:--approach, be at hand, come (draw) near, be (come, draw) nigh. see G1451,
G1449	ἐγγράφω	engráphō	eng-graf'-o	from G1722 and G1125 ; def: to "engrave", i.e. inscribe kjv:--write (in). see G1722, see G1125,
G1450	ἔγγυος	éngyos	eng'-goo-os	from G1722 and (a limb); def: pledged (as if articulated by a member), i.e. a bondsman kjv:--surety. see G1722,
G1451	ἐγγύς	engýs	eng-goos'	from a primary verb (to squeeze or throttle; def: akin to the base of kjv:--from , at hand, near, nigh (at hand, unto), ready. see G43,
G1452	ἐγγύτερον	engýteron	eng-goo'-ter-on	neuter of the comparative of G1451 ; def: nearer kjv:--nearer. see G1451,
G1453	ἐγείρω	egeírō	eg-i'-ro	probably akin to the base of G58 (through the idea of collecting one's faculties); def: to waken (transitively or intransitively), i.e. rouse (literally, from sleep, from sitting or lying, from disease, from death; or figuratively, from obscurity, inactivity, ruins, nonexistence) kjv:--awake, lift (up), raise (again, up), rear up, (a-)rise (again, up), stand, take up. see G58,
G1454	ἔγερσις	égersis	eg'-er-sis	from G1453 ; def: a resurgence (from death) kjv:--resurrection. see G1453,
G1455	ἐγκάθετος	enkáthetos	eng-kath'-et-os	from G1722 and a derivative of G2524 ; def: subinduced, i.e. surreptitiously suborned as a lier-in-wait kjv:--spy. see G1722, see G2524,
G1456	ἐγκαίνια	enkaínia	eng-kah'-ee-nee-ah	neuter plural of a presumed compound from G1722 and G2537 ; def: innovatives, i.e. (specially) renewal (of religious services after the Antiochian interruption) kjv:--dedication. see G1722, see G2537,
G1457	ἐγκαινίζω	enkainízō	eng-kahee-nid'-zo	from G1456 ; def: to renew, i.e. inaugurate kjv:--consecrate, dedicate. see G1456,
G1458	ἐγκαλέω	enkaléō	eng-kal-eh'-o	from G1722 and G2564 ; def: to call in (as a debt or demand), i.e. bring to account (charge, criminate, etc.) kjv:--accuse, call in question, implead, lay to the charge. see G1722, see G2564,
G1459	ἐγκαταλείπω	enkataleípō	eng-kat-al-i'-po	from G1722 and G2641 ; def: to leave behind in some place, i.e. (in a good sense) let remain over, or (in a bad sense) to desert kjv:--forsake, leave. see G1722, see G2641,
G1460	ἐγκατοικέω	enkatoikéō	eng-kat-oy-keh'-o	from G1722 and G2730 ; def: to settle down in a place, i.e. reside kjv:--dwell among. see G1722, see G2730,
G1461	ἐγκεντρίζω	enkentrízō	eng-ken-trid'-zo	from G1722 and a derivative of G2759 ; def: to prick in, i.e. ingraft kjv:--graff in(-to). see G1722, see G2759,
G1462	ἔγκλημα	énklēma	eng'-klay-mah	from G1458 ; def: an accusation, i.e. offence alleged kjv:--crime laid against, laid to charge. see G1458,
G1463	ἐγκομβόομαι	enkombóomai	eng-kom-bo'-om-ahee	middle voice from G1722 and (to gird); def: to engirdle oneself (for labor), i.e. figuratively (the apron as being a badge of servitude) to wear (in token of mutual deference) kjv:--be clothed with. see G1722,
G1464	ἐγκοπή	enkopḗ	eng-kop-ay'	from G1465 ; def: a hindrance kjv:--X hinder. see G1465,
G1465	ἐγκόπτω	enkóptō	eng-kop'-to	from G1722 and G2875 ; def: to cut into, i.e. (figuratively) impede, detain kjv:--hinder, be tedious unto. see G1722, see G2875,
G1466	ἐγκράτεια	enkráteia	eng-krat'-i-ah	from G1468 ; def: self-control (especially continence) kjv:--temperance. see G1468,
G1467	ἐγκρατεύομαι	enkrateúomai	eng-krat-yoo'-om-ahee	middle voice from G1468 ; def: to exercise self-restraint (in diet and chastity) kjv:--can(-not) contain, be temperate. see G1468,
G1468	ἐγκρατής	enkratḗs	eng-krat-ace'	from G1722 and G2904 ; def: strong in a thing (masterful), i.e. (figuratively and reflexively) self-controlled (in appetite, etc.) kjv:--temperate. see G1722, see G2904,
G1469	ἐγκρίνω	enkrínō	eng-kree'-no	from G1722 and G2919 ; def: to judge in, i.e. count among kjv:--make of the number. see G1722, see G2919,
G1470	ἐγκρύπτω	enkrýptō	eng-kroop'-to	from G1722 and G2928 ; def: to conceal in, i.e. incorporate with kjv:--hid in. see G1722, see G2928,
G1471	ἔγκυος	énkyos	eng'-koo-os	from G1722 and the base of G2949 ; def: swelling inside, i.e. pregnant kjv:--great with child. see G1722, see G2949,
G1472	ἐγχρίω	enchríō	eng-khree'-o	from G1722 and G5548 ; def: to rub in (oil), i.e. besmear kjv:--anoint. see G1722, see G5548,
G1473	ἐγώ	egṓ	eg-o'	a primary pronoun of the first person I (only expressed when emphatic) kjv:--I, me. see G1691, see G1698, see G1700, see G2248, see G2249, see G2254, see G2257,
G1474	ἐδαφίζω	edaphízō	ed-af-id'-zo	from G1475 ; def: to raze kjv:--lay even with the ground. see G1475,
G1475	ἔδαφος	édaphos	ed'-af-os	from the base of G1476 ; def: a basis (bottom), i.e. the soil kjv:--ground. see G1476,
G1476	ἑδραῖος	hedraîos	hed-rah'-yos	from a derivative of (to sit); def: sedentary, i.e. (by implication) immovable kjv:--settled, stedfast.
G1477	ἑδραίωμα	hedraíōma	hed-rah'-yo-mah	from a derivative of G1476 ; def: a support, i.e. (figuratively) basis kjv:--ground. see G1476,
G1478	Ἐζεκίας	Ezekías	ed-zek-ee'-as	of Hebrew origin ( H02396 ); def: Ezekias (i.e. Hezekeiah), an Israelite kjv:--Ezekias. see H02396,
G1479	ἐθελοθρησκεία	ethelothrēskeía	eth-el-oth-race-ki'-ah	from G2309 and G2356 ; def: voluntary (arbitrary and unwarranted) piety, i.e. sanctimony kjv:--will worship. see G2309, see G2356,
G1480	ἐθίζω	ethízō	eth-id'-zo	from G1485 ; def: to accustom, i.e. (neuter passive participle) customary kjv:--custom. see G1485,
G1481	ἐθνάρχης	ethnárchēs	eth-nar'-khace	from G1484 and G746 ; def: the governor (not king) of a district kjv:--ethnarch. see G1484, see G746,
G1482	ἐθνικός	ethnikós	eth-nee-kos'	from G1484 ; def: national ("ethnic"), i.e. (specially) a Gentile kjv:--heathen (man). see G1484,
G1483	ἐθνικῶς	ethnikōs	eth-nee-koce'	adverb from G1482 ; def: as a Gentile kjv:--after the manner of Gentiles. see G1482,
G1484	ἔθνος	éthnos	eth'-nos	probably from G1486 ; def: a race (as of the same habit), i.e. a tribe; specially, a foreign (non-Jewish) one (usually, by implication, pagan) kjv:--Gentile, heathen, nation, people. see G1486,
G1485	ἔθος	éthos	eth'-os	from G1486 ; def: a usage (prescribed by habit or law) kjv:--custom, manner, be wont. see G1486,
G1486	ἔθω	éthō	eth'-o	a primary verb; def: to be used (by habit or conventionality); neuter perfect participle usage kjv:--be custom (manner, wont).
G1487	εἰ	ei	i	a primary particle of conditionality; def: if, whether, that, etc. kjv:--forasmuch as, if, that, (al-)though, whether. see G1489, see G1490, see G1499, see G1508, see G1509, see G1512, see G1513, see G1536, see G1537, see G1437,
G1488	εἶ	eî	i	second person singular present of G1510 ; def: thou art kjv:--art, be. see G1510,
G1489	εἴγε	eíge	i'-gheh	from G1487 and G1065 ; def: if indeed, seeing that, unless, (with negative) otherwise kjv:--if (so be that, yet). see G1487, see G1065,
G1490	εἰ δὲ μή(γε)	ei dè mḗ(ge)	i deh may'-(gheh)	from G1487 , G1161 , and G3361 (sometimes with G1065 added); def: but if not kjv:--(or) else, if (not, otherwise), otherwise. see G1487, see G1161, see G3361, see G1065,
G1491	εἶδος	eîdos	i'-dos	from G1492 ; def: a view, i.e. form (literally or figuratively) kjv:--appearance, fashion, shape, sight. see G1492,
G1492	εἴδω	eídō	i'-do	a primary verb; def: used only in certain past tenses, the others being borrowed from the equivalent kjv:--be aware, behold, X can (+ not tell), consider, (have) know(-ledge), look (on), perceive, see, be sure, tell, understand, wish, wot. see G3700, see G3708, see G3700,
G1493	εἰδωλεῖον	eidōleîon	i-do-li'-on	neuter of a presumed derivative of G1497 ; def: an image-fane kjv:--idol's temple. see G1497,
G1494	εἰδωλόθυτον	eidōlóthyton	i-do-loth'-oo-ton	neuter of a compound of G1497 and a presumed derivative of G2380 ; def: an image-sacrifice, i.e. part of an idolatrous offering kjv:--(meat, thing that is) offered (in sacrifice, sacrificed) to (unto) idols. see G1497, see G2380,
G1495	εἰδωλολατρεία	eidōlolatreía	i-do-lol-at-ri'-ah	from G1497 and G2999 ; def: image-worship (literally or figuratively) kjv:--idolatry. see G1497, see G2999,
G1496	εἰδωλολάτρης	eidōlolátrēs	i-do-lol-at'-race	from G1497 and the base of G3000 ; def: an image- (servant or) worshipper (literally or figuratively) kjv:--idolater. see G1497, see G3000,
G1497	εἴδωλον	eídōlon	i'-do-lon	from G1491 ; def: an image (i.e. for worship); by implication, a heathen god, or (plural) the worship of such kjv:--idol. see G1491,
G1498	εἴην	eíēn	i'-ane	optative (i.e. English subjunctive) present of G1510 (including the other person); def: might (could, would, or should) be kjv:--mean, + perish, should be, was, were. see G1510,
G1499	εἰ καί	ei kaí	i kahee	from G1487 and G2532 ; def: if also (or even) kjv:--if (that), though. see G1487, see G2532,
G1500	εἰκῆ	eikē	i-kay'	probably from G1502 (through the idea of failure); def: idly, i.e. without reason (or effect) kjv:--without a cause, (in) vain(-ly). see G1502,
G1501	εἴκοσι	eíkosi	i'-kos-ee	of uncertain affinity; def: a score kjv:--twenty.
G1502	εἴκω	eíkō	i'-ko	apparently a primary verb; def: properly, to be weak, i.e. yield kjv:--give place.
G1503	εἴκω	eíkō	i'-ko	apparently a primary verb (perhaps akin to G1502 through the idea of faintness as a copy); def: to resemble kjv:--be like. see G1502,
G1504	εἰκών	eikṓn	i-kone'	from G1503 ; def: a likeness, i.e. (literally) statue, profile, or (figuratively) representation, resemblance kjv:--image. see G1503,
G1505	εἰλικρίνεια	eilikríneia	i-lik-ree'-ni-ah	from G1506 ; def: clearness, i.e. (by implication) purity (figuratively) kjv:--sincerity. see G1506,
G1506	εἰλικρινής	eilikrinḗs	i-lik-ree-nace'	from (the sun's ray) and G2919 ; def: judged by sunlight, i.e. tested as genuine (figuratively) kjv:--pure, sincere. see G2919,
G1507	εἱλίσσω	heilíssō	hi-lis'-so	a prolonged form of a primary but defective verb (of the same meaning); def: to coil or wrap kjv:--roll together. see G1667,
G1508	εἰ μή	ei mḗ	i may	from G1487 and G3361 ; def: if not kjv:--but, except (that), if not, more than, save (only) that, saving, till. see G1487, see G3361,
G1509	εἰ μή τι	ei mḗ ti	i may tee	from G1508 and the neuter of G5100 ; def: if not somewhat kjv:--except. see G1508, see G5100,
G1510	εἰμί	eimí	i-mee'	the first person singular present indicative; a prolonged form of a primary and defective verb; def: I exist (used only when emphatic) kjv:--am, have been, X it is I, was. see G1488, see G1498, see G1511, see G1527, see G2258, see G2071, see G2070, see G2075, see G2076, see G2771, see G2468, see G5600,
G1511	εἶναι	eînai	i'-nahee	present infinitive from G1510 ; def: to exist kjv:--am, was. see G1510,
G1512	εἴ περ	eí per	i per	from G1487 and G4007 ; def: if perhaps kjv:--if so be (that), seeing, though. see G1487, see G4007,
G1513	εἴ πως	eí pōs	i poce	from G1487 and G4458 ; def: if somehow kjv:--if by any means. see G1487, see G4458,
G1514	εἰρηνεύω	eirēneúō	i-rane-yoo'-o	from G1515 ; def: to be (act) peaceful kjv:--be at (have, live in) peace, live peaceably. see G1515,
G1515	εἰρήνη	eirḗnē	i-ray'-nay	probably from a primary verb (to join); def: peace (literally or figuratively); by implication, prosperity kjv:--one, peace, quietness, rest, + set at one again.
G1516	εἰρηνικός	eirēnikós	i-ray-nee-kos'	from G1515 ; def: pacific; by implication, salutary kjv:--peaceable. see G1515,
G1517	εἰρηνοποιέω	eirēnopoiéō	i-ray-nop-oy-eh'-o	from G1518 ; def: to be a peace-maker, i.e. (figuratively) to harmonize kjv:--make peace. see G1518,
G1518	εἰρηνοποιός	eirēnopoiós	i-ray-nop-oy-os'	from G1515 and G4160 ; def: pacificatory, i.e. (subjectively) peaceable kjv:--peacemaker. see G1515, see G4160,
G1519	εἰς	eis	ice	a primary preposition; def: to or into (indicating the point reached or entered), of place, time, or (figuratively) purpose (result, etc.); also in adverbial phrases kjv:--(abundant-)ly, against, among, as, at, (back-)ward, before, by, concerning, + continual, + far more exceeding, for (intent, purpose), fore, + forth, in (among, at, unto, -so much that, -to), to the intent that, + of one mind, + never, of, (up-)on, + perish, + set at one again, (so) that, therefore(-unto), throughout, til, to (be, the end, -ward), (here-)until(-to), …ward, (where-)fore, with.
G1520	εἷς	heîs	hice	a primary numeral; def: one kjv:--a(-n, -ny, certain), + abundantly, man, one (another), only, other, some. see G1527, see G3367, see G3391, see G3762,
G1521	εἰσάγω	eiságō	ice-ag'-o	from G1519 and G71 ; def: to introduce (literally or figuratively) kjv:--bring in(-to), (+ was to) lead into. see G1519, see G71,
G1522	εἰσακούω	eisakoúō	ice-ak-oo'-o	from G1519 and G191 ; def: to listen to kjv:--hear. see G1519, see G191,
G1523	εἰσδέχομαι	eisdéchomai	ice-dekh'-om-ahee	from G1519 and G1209 ; def: to take into one's favor kjv:--receive. see G1519, see G1209,
G1524	εἴσειμι	eíseimi	ice'-i-mee	from G1519 and (to go); def: to enter kjv:--enter (go) into. see G1519,
G1525	εἰσέρχομαι	eisérchomai	ice-er'-khom-ahee	from G1519 and G2064 ; def: to enter (literally or figuratively) kjv:--X arise, come (in, into), enter in(-to), go in (through). see G1519, see G2064,
G1526	εἰσί	eisí	i-see'	3rd person plural present indicative of G1510 ; def: they are kjv:--agree, are, be, dure, X is, were. see G1510,
G1527	εἷς καθ’ εἷς	heîs kath’ heîs	hice kath hice	from G1520 repeated with G2596 inserted; def: severally kjv:--one by one. see G1520, see G2596,
G1528	εἰσκαλέω	eiskaléō	ice-kal-eh'-o	from G1519 and G2564 ; def: to invite in kjv:--call in. see G1519, see G2564,
G1529	εἴσοδος	eísodos	ice'-od-os	from G1519 and G3598 ; def: an entrance (literally or figuratively) kjv:--coming, enter(-ing) in (to). see G1519, see G3598,
G1530	εἰσπηδάω	eispēdáō	ice-pay-dah'-o	from G1519 and (to leap); def: to rush in kjv:--run (spring) in. see G1519,
G1531	εἰσπορεύομαι	eisporeúomai	ice-por-yoo'-om-ahee	from G1519 and G4198 ; def: to enter (literally or figuratively) kjv:--come (enter) in, go into. see G1519, see G4198,
G1532	εἰστρέχω	eistréchō	ice-trekh'-o	from G1519 and G5143 ; def: to hasten inward kjv:--run in. see G1519, see G5143,
G1533	εἰσφέρω	eisphérō	ice-fer'-o	from G1519 and G5342 ; def: to carry inward (literally or figuratively) kjv:--bring (in), lead into. see G1519, see G5342,
G1534	εἶτα	eîta	i'-tah	of uncertain affinity; def: a particle of succession (in time or logical enumeration), then, moreover kjv:--after that(-ward), furthermore, then. see G1899,
G1535	εἴτε	eíte	i'-teh	from G1487 and G5037 ; def: if too kjv:--if, or, whether. see G1487, see G5037,
G1536	εἴ τις	eí tis	i tis	from G1487 and G5100 ; def: if any kjv:--he that, if a(-ny) man('s thing, from any, ought), whether any, whosoever. see G1487, see G5100,
G1537	ἐξ	ex	ek	a primary preposition denoting origin (the point whence action or motion proceeds), from, out (of place, time, or cause; def: literal or figurative; direct or remote) kjv:--after, among, X are, at, betwixt(-yond), by (the means of), exceedingly, (+ abundantly above), for(- th), from (among, forth, up), + grudgingly, + heartily, X heavenly, X hereby, + very highly, in, …ly, (because, by reason) of, off (from), on, out among (from, of), over, since, X thenceforth, through, X unto, X vehemently, with(-out).
G1538	ἕκαστος	hékastos	hek'-as-tos	as if a superlative of (afar); def: each or every kjv:--any, both, each (one), every (man, one, woman), particularly.
G1539	ἑκάστοτε	hekástote	hek-as'-tot-eh	as if from G1538 and G5119 ; def: at every time kjv:--always. see G1538, see G5119,
G1540	ἑκατόν	hekatón	hek-at-on'	of uncertain affinity; def: a hundred kjv:--hundred.
G1541	ἑκατονταέτης	hekatontaétēs	hek-at-on-tah-et'-ace	from G1540 and G2094 ; def: centenarian kjv:--hundred years old. see G1540, see G2094,
G1542	ἑκατονταπλασίων	hekatontaplasíōn	hek-at-on-ta-plah-sec'-own	from G1540 and a presumed derivative of G4111 ; def: a hundred times kjv:--hundredfold. see G1540, see G4111,
G1543	ἑκατόνταρχος	hekatóntarchos	hek-at-on-tar'-khace	from G1540 and G757 ; def: the captain of one hundred men kjv:--centurion. see G1540, see G757,
G1544	ἐκβάλλω	ekbállō	ek-bal'-lo	from G1537 and G906 ; def: to eject (literally or figuratively) kjv:--bring forth, cast (forth, out), drive (out), expel, leave, pluck (pull, take, thrust) out, put forth (out), send away (forth, out). see G1537, see G906,
G1545	ἔκβασις	ékbasis	ek'-bas-is	from a compound of G1537 and the base of G939 (meaning to go out); def: an exit (literally or figuratively) kjv:--end, way to escape. see G1537, see G939,
G1546	ἐκβολή	ekbolḗ	ek-bol-ay'	from G1544 ; def: ejection, i.e. (specially) a throwing overboard of the cargo kjv:--+ lighten the ship. see G1544,
G1547	ἐκγαμίζω	ekgamízō	ek-gam-id'-zo	from G1537 and a form of G1061 (compare G1548 ); def: to marry off a daughter kjv:--give in marriage. see G1537, see G1061, see G1548,
G1548	ἐκγαμίσκω	ekgamískō	ek-gam-is'-ko	from G1537 and G1061 ; def: the same as 1547 kjv:--give in marriage. see G1537, see G1061,
G1549	ἔκγονον	ékgonon	ek'-gon-on	neuter of a derivative of a compound of G1537 and G1096 ; def: a descendant, i.e. (specially) grandchild kjv:--nephew. see G1537, see G1096,
G1550	ἐκδαπανάω	ekdapanáō	ek-dap-an-ah'-o	from G1537 and G1159 ; def: to expend (wholly), i.e. (figuratively) exhaust kjv:--spend. see G1537, see G1159,
G1551	ἐκδέχομαι	ekdéchomai	ek-dekh'-om-ahee	from G1537 and G1209 ; def: to accept from some source, i.e. (by implication) to await kjv:--expect, look (tarry) for, wait (for). see G1537, see G1209,
G1552	ἔκδηλος	ékdēlos	ek'-day-los	from G1537 and G1212 ; def: wholly evident kjv:--manifest. see G1537, see G1212,
G1553	ἐκδημέω	ekdēméō	ek-day-meh'-o	from a compound of G1537 and G1218 ; def: to emigrate, i.e. (figuratively) vacate or quit kjv:--be absent. see G1537, see G1218,
G1554	ἐκδίδωμι	ekdídōmi	ek-did-o'-mee	from G1537 and G1325 ; def: to give forth, i.e. (specially) to lease kjv:--let forth (out). see G1537, see G1325,
G1555	ἐκδιηγέομαι	ekdiēgéomai	ek-dee-ayg-eh'-om-ahee	from G1537 and a compound of G1223 and G2233 ; def: to narrate through wholly kjv:--declare. see G1537, see G1223, see G2233,
G1556	ἐκδικέω	ekdikéō	ek-dik-eh'-o	from G1558 ; def: to vindicate, retaliate, punish kjv:--a (re-)venge. see G1558,
G1557	ἐκδίκησις	ekdíkēsis	ek-dik'-ay-sis	from G1556 ; def: vindication, retribution kjv:--(a-, re-)venge(-ance), punishment. see G1556,
G1558	ἔκδικος	ékdikos	ek'-dik-os	from G1537 and G1349 ; def: carrying justice out, i.e. a punisher kjv:--a (re-)venger. see G1537, see G1349,
G1559	ἐκδιώκω	ekdiṓkō	ek-dee-o'-ko	from G1537 and G1377 ; def: to pursue out, i.e. expel or persecute implacably kjv:--persecute. see G1537, see G1377,
G1560	ἔκδοτος	ékdotos	ek'-dot-os	from G1537 and a derivative of G1325 ; def: given out or over, i.e. surrendered kjv:--delivered. see G1537, see G1325,
G1561	ἐκδοχή	ekdochḗ	ek-dokh-ay'	from G1551 ; def: expectation kjv:--looking for. see G1551,
G1562	ἐκδύω	ekdýō	ek-doo'-o	from G1537 and the base of G1416 ; def: to cause to sink out of, i.e. (specially as of clothing) to divest kjv:--strip, take off from, unclothe. see G1537, see G1416,
G1563	ἐκεῖ	ekeî	ek-i'	of uncertain affinity; def: there; by extension, thither kjv:--there, thither(-ward), (to) yonder (place).
G1564	ἐκεῖθεν	ekeîthen	ek-i'-then	from G1563 ; def: thence kjv:--from that place, (from) thence, there. see G1563,
G1565	ἐκεῖνος	ekeînos	ek-i'-nos	from G1563 ; def: that one (or (neuter) thing); often intensified by the article prefixed kjv:--he, it, the other (same), selfsame, that (same, very), X their, X them, they, this, those. see G1563, see G3778,
G1566	ἐκεῖσε	ekeîse	ek-i'-seh	from G1563 ; def: thither kjv:--there. see G1563,
G1567	ἐκζητέω	ekzētéō	ek-zay-teh'-o	from G1537 and G2212 ; def: to search out, i.e. (figuratively)investigate, crave, demand, (by Hebraism) worship kjv:--en- (re-)quire, seek after (carefully, diligently). see G1537, see G2212,
G1568	ἐκθαμβέω	ekthambéō	ek-tham-beh'-o	from G1569 ; def: to astonish utterly kjv:--affright, greatly (sore) amaze. see G1569,
G1569	ἔκθαμβος	ékthambos	ek'-tham-bos	from G1537 and G2285 ; def: utterly astounded kjv:--greatly wondering. see G1537, see G2285,
G1570	ἔκθετος	ékthetos	ek'-thet-os	from G1537 and a derivative of G5087 ; def: put out, i.e. exposed to perish kjv:--cast out. see G1537, see G5087,
G1571	ἐκκαθαίρω	ekkathaírō	ek-kath-ah'-ee-ro	from G1537 and G2508 ; def: to cleanse thoroughly kjv:--purge (out). see G1537, see G2508,
G1572	ἐκκαίω	ekkaíō	ek-kah'-yo	from G1537 and G2545 ; def: to inflame deeply kjv:--burn. see G1537, see G2545,
G1573	ἐκκακέω	ekkakéō	ek-kak-eh'-o	from G1537 and G2556 ; def: to be (bad or) weak, i.e. (by implication) to fail (in heart) kjv:--faint, be weary. see G1537, see G2556,
G1574	ἐκκεντέω	ekkentéō	ek-ken-teh'-o	from G1537 and the base of G2759 ; def: to transfix kjv:--pierce. see G1537, see G2759,
G1575	ἐκκλάω	ekkláō	ek-klah'-o	from G1537 and G2806 ; def: to exscind kjv:--break off. see G1537, see G2806,
G1576	ἐκκλείω	ekkleíō	ek-kli'-o	from G1537 and G2808 ; def: to shut out (literally or figuratively) kjv:--exclude. see G1537, see G2808,
G1577	ἐκκλησία	ekklēsía	ek-klay-see'-ah	from a compound of G1537 and a derivative of G2564 ; def: a calling out, i.e. (concretely) a popular meeting, especially a religious congregation (Jewish synagogue, or Christian community of members on earth or saints in heaven or both) kjv:--assembly, church. see G1537, see G2564,
G1578	ἐκκλίνω	ekklínō	ek-klee'-no	from G1537 and G2827 ; def: to deviate, i.e. (absolutely) to shun (literally or figuratively), or (relatively) to decline (from piety) kjv:--avoid, eschew, go out of the way. see G1537, see G2827,
G1579	ἐκκολυμβάω	ekkolymbáō	ek-kol-oom-bah'-o	from G1537 and G2860 ; def: to escape by swimming kjv:--swim out. see G1537, see G2860,
G1580	ἐκκομίζω	ekkomízō	ek-kom-id'-zo	from G1537 and G2865 ; def: to bear forth (to burial) kjv:--carry out. see G1537, see G2865,
G1581	ἐκκόπτω	ekkóptō	ek-kop'-to	from G1537 and G2875 ; def: to exscind; figuratively, to frustrate kjv:--cut down (off, out), hew down, hinder. see G1537, see G2875,
G1582	ἐκκρέμαμαι	ekkrémamai	ek-krem'-am-ahee	middle voice from G1537 and G2910 ; def: to hang upon the lips of a speaker, i.e. listen closely kjv:--be very attentive. see G1537, see G2910,
G1583	ἐκλαλέω	eklaléō	ek-lal-eh'-o	from G1537 and G2980 ; def: to divulge kjv:--tell. see G1537, see G2980,
