id	unicode_word	translit	pronunciation	full_definition
G2840	κοινόω	koinóō	koy-no'-o	from G2839 ; def: to make (or consider) profane (ceremonially) kjv:--call common, defile, pollute, unclean. see G2839,
G2841	κοινωνέω	koinōnéō	koy-no-neh'-o	from G2844 ; def: to share with others (objectively or subjectively) kjv:--communicate, distribute, be partaker. see G2844,
G2842	κοινωνία	koinōnía	koy-nohn-ee'-ah	from G2844 ; def: partnership, i.e. (literally) participation, or (social) intercourse, or (pecuniary) benefaction kjv:--(to) communicate(-ation), communion, (contri-)distribution, fellowship. see G2844,
G2843	κοινωνικός	koinōnikós	koy-no-nee-kos'	from G2844 ; def: communicative, i.e. (pecuniarily) liberal kjv:--willing to communicate. see G2844,
G2844	κοινωνός	koinōnós	koy-no-nos'	from G2839 ; def: a sharer, i.e. associate kjv:--companion, X fellowship, partaker, partner. see G2839,
G2845	κοίτη	koítē	koy'-tay	from G2749 ; def: a couch; by extension, cohabitation; by implication, the male sperm kjv:--bed, chambering, X conceive. see G2749,
G2846	κοιτών	koitṓn	koy-tone'	from G2845 ; def: a bedroom kjv:--+ chamberlain. see G2845,
G2847	κόκκινος	kókkinos	kok'-kee-nos	from G2848 (from the kernel-shape of the insect); def: crimson-colored kjv:--scarlet (colour, coloured). see G2848,
G2848	κόκκος	kókkos	kok'-kos	apparently a primary word; def: a kernel of seed kjv:--corn, grain.
G2849	κολάζω	kolázō	kol-ad'-zo	from (dwarf); def: properly, to curtail, i.e. (figuratively) to chastise (or reserve for infliction) kjv:--punish.
G2850	κολακεία	kolakeía	kol-ak-i'-ah	from a derivative of (a fawner); def: flattery kjv:-- X flattering.
G2851	κόλασις	kólasis	kol'-as-is	from G2849 ; def: penal infliction kjv:--punishment, torment. see G2849,
G2852	κολαφίζω	kolaphízō	kol-af-id'-zo	from a derivative of the base of G2849 ; def: to rap with the fist kjv:--buffet. see G2849,
G2853	κολλάω	kolláō	kol-lah'-o	from ("glue"); def: to glue, i.e. (passively or reflexively) to stick (figuratively) kjv:--cleave, join (self), keep company.
G2854	κολλούριον	kolloúrion	kol-loo'-ree-on	neuter of a presumed derivative of (a cake; def: prob akin to the base of kjv:-- eyesalve. see G2853,
G2855	κολλυβιστής	kollybistḗs	kol-loo-bis-tace'	from a presumed derivative of (a small coin; def: probably akin to kjv:--(money-)changer. see G2854,
G2856	κολοβόω	kolobóō	kol-ob-o'-o	from a derivative of the base of G2849 ; def: to dock, i.e. (figuratively) abridge kjv:--shorten. see G2849,
G2857	Κολοσσαί	Kolossaí	kol-os-sah'-ee	apparently feminine plural of kolossos ("colossal"); def: Colossæ, a place in Asia Minor kjv:--Colosse.
G2858	Κολοσσαεύς	Kolossaeús	kol-os-sayoos'	from G2857 ; def: a Colossæan, (i.e. inhabitant of Colossæ kjv:--Colossian. see G2857,
G2859	κόλπος	kólpos	kol'-pos	apparently a primary word; def: the bosom; by analogy, a bay kjv:--bosom, creek.
G2860	κολυμβάω	kolymbáō	kol-oom-bah'-o	from (a diver); def: to plunge into water kjv:--swim.
G2861	κολυμβήθρα	kolymbḗthra	kol-oom-bay'-thrah	from G2860 ; def: a diving-place, i.e. pond for bathing (or swimming) kjv:--pool. see G2860,
G2862	κολωνία	kolōnía	kol-o-nee'-ah	of Latin origin; def: a Roman "colony" for veterans kjv:--colony.
G2863	κομάω	komáō	kom-ah'-o	from G2864 ; def: to wear tresses of hair kjv:--have long hair. see G2864,
G2864	κόμη	kómē	kom'-ay	apparently from the same as G2865 ; def: the hair of the head (locks, as ornamental, and thus differing from kjv:--hair. see G2865, see G2359,
G2865	κομίζω	komízō	kom-id'-zo	from a primary (to tend, i.e. take care of); def: properly, to provide for, i.e. (by implication) to carry off (as if from harm; genitive case obtain) kjv:--bring, receive.
G2866	κομψότερον	kompsóteron	komp-sot'-er-on	neuter comparative of a derivative of the base of 2865 (meaning, properly, well dressed, i.e. nice); def: figuratively, convalescent kjv:--+ began to amend.
G2867	κονιάω	koniáō	kon-ee-ah'-o	from (dust; def: by analogy, lime); to whitewash kjv:--whiten.
G2868	κονιορτός	koniortós	kon-ee-or-tos'	from the base of G2867 and ornumi (to "rouse"); def: pulverulence (as blown about) kjv:--dust. see G2867,
G2869	κοπάζω	kopázō	kop-ad'-zo	from G2873 ; def: to tire, i.e. (figuratively) to relax kjv:--cease. see G2873,
G2870	κοπετός	kopetós	kop-et-os'	from G2875 ; def: mourning (properly, by beating the breast) kjv:--lamentation. see G2875,
G2871	κοπή	kopḗ	kop-ay'	from G2875 ; def: cutting, i.e. carnage kjv:--slaughter. see G2875,
G2872	κοπιάω	kopiáō	kop-ee-ah'-o	from a derivative of G2873 ; def: to feel fatigue; by implication, to work hard kjv:--(bestow) labour, toil, be wearied. see G2873,
G2873	κόπος	kópos	kop'-os	from G2875 ; def: a cut, i.e. (by analogy) toil (as reducing the strength), literally or figuratively; by implication, pains kjv:--labour, + trouble, weariness. see G2875,
G2874	κοπρία	kopría	kop-ree'-ah	from (ordure; def: perhaps akin to kjv:--dung(-hill). see G2875,
G2875	κόπτω	kóptō	kop'-to	a primary verb; def: to "chop"; specially, to beat the breast in grief kjv:--cut down, lament, mourn, (be-)wail. see G5114,
G2876	κόραξ	kórax	kor'-ax	perhaps from G2880 ; def: a crow (from its voracity) kjv:--raven. see G2880,
G2877	κοράσιον	korásion	kor-as'-ee-on	neuter of a presumed derivative of (a maiden); def: a (little) girl kjv:--damsel, maid.
G2878	κορβανᾶς	korbanâs	kor-ban'	of Hebrew and Chaldee origin respectively ( H07133 ); def: a votive offering and the offering; a consecrated present (to the Temple fund); by extension (the latter term) the Treasury itself, i.e. the room where the contribution boxes stood kjv:--Corban, treasury. see H07133,
G2879	Κορέ	Koré	kor-eh'	of Hebrew origin ( H07141 ); def: Core (i.e. Korach), an Israelite kjv:--Core. see H07141,
G2880	κορέννυμι	korénnymi	kor-en'-noo-mee	a primary verb; def: to cram, i.e. glut or sate kjv:--eat enough, full.
G2881	Κορίνθιος	Korínthios	kor-in'-thee-os	from G2882 ; def: a Corinthian, i.e. inhabitant of Corinth kjv:--Corinthian. see G2882,
G2882	Κόρινθος	Kórinthos	kor'-in-thos	of uncertain derivation; def: Corinthus, a city of Greece kjv:--Corinth.
G2883	Κορνήλιος	Kornḗlios	kor-nay'-lee-os	of Latin origin; def: Cornelius, a Roman kjv:--Cornelius.
G2884	κόρος	kóros	kor'-os	of Hebrew origin ( H03734 ); def: a cor, i.e. a specific measure kjv:--measure. see H03734,
G2885	κοσμέω	kosméō	kos-meh'-o	from G2889 ; def: to put in proper order, i.e. decorate (literally or figuratively); specially, to snuff (a wick) kjv:--adorn, garnish, trim. see G2889,
G2886	κοσμικός	kosmikós	kos-mee-kos'	from G2889 (in its secondary sense); def: terrene ("cosmic"), literally (mundane) or figuratively (corrupt) kjv:--worldly. see G2889,
G2887	κόσμιος	kósmios	kos'-mee-os	from G2889 (in its primary sense); def: orderly, i.e. decorous kjv:--of good behaviour, modest. see G2889,
G2888	κοσμοκράτωρ	kosmokrátōr	kos-mok-fat'-ore	from G2889 and G2902 ; def: a world-ruler, an epithet of Satan kjv:--ruler. see G2889, see G2902,
G2889	κόσμος	kósmos	kos'-mos	probably from the base of G2865 ; def: orderly arrangement, i.e. decoration; by implication, the world (in a wide or narrow sense, including its inhabitants, literally or figuratively (morally)) kjv:--adorning, world. see G2865,
G2890	Κούαρτος	Koúartos	koo'-ar-tos	of Latin origin (fourth); def: Quartus, a Christian kjv:--Quartus.
G2891	κοῦμι	koûmi	koo'-mee	of Chaldee origin ( H06966 ); def: cumi (i.e. rise!) kjv:--cumi. see H06966,
G2892	κουστωδία	koustōdía	koos-to-dee'-ah	of Latin origin; def: "custody", i.e. a Roman sentry kjv:--watch.
G2893	κουφίζω	kouphízō	koo-fid'-zo	from (light in weight); def: to unload kjv:--lighten.
G2894	κόφινος	kóphinos	kof'-ee-nos	of uncertain derivation; def: a (small) basket kjv:--basket.
G2895	κράββατος	krábbatos	krab'-bat-os	probably of foreign origin; def: a mattress kjv:--bed.
G2896	κράζω	krázō	krad'-zo	a primary verb; def: properly, to "croak" (as a raven) or scream, i.e. (genitive case) to call aloud (shriek, exclaim, intreat) kjv:--cry (out).
G2897	κραιπάλη	kraipálē	krahee-pal'-ay	probably from the same as G726 ; def: properly, a headache (as a seizure of pain) from drunkenness, i.e. (by implication) a debauch (by analogy, a glut) kjv:--surfeiting. see G726,
G2898	κρανίον	kraníon	kran-ee'-on	diminutive of a derivative of the base of G2768 ; def: a skull ("cranium") kjv:--Calvary, skull. see G2768,
G2899	κράσπεδον	kráspedon	kras'-ped-on	of uncertain derivation; def: a margin, i.e. (specially), a fringe or tassel kjv:--border, hem.
G2900	κραταιός	krataiós	krat-ah-yos'	from G2904 ; def: powerful kjv:--mighty. see G2904,
G2901	κραταιόω	krataióō	krat-ah-yo'-o	from G2900 ; def: to empower, i.e. (passively) increase in vigor kjv:--be strengthened, be (wax) strong. see G2900,
G2902	κρατέω	kratéō	krat-eh'-o	from G2904 ; def: to use strength, i.e. seize or retain (literally or figuratively) kjv:--hold (by, fast), keep, lay hand (hold) on, obtain, retain, take (by). see G2904,
G2903	κράτιστος	krátistos	krat'-is-tos	superlative of a derivative of G2904 ; def: strongest, i.e. (in dignity) very honorable kjv:--most excellent (noble). see G2904,
G2904	κράτος	krátos	krat'-os	perhaps a primary word; def: vigor ("great") (literally or figuratively) kjv:--dominion, might(-ily), power, strength.
G2905	κραυγάζω	kraugázō	krow-gad'-zo	from G2906 ; def: to clamor kjv:--cry out. see G2906,
G2906	κραυγή	kraugḗ	krow-gay'	from G2896 ; def: an outcry (in notification, tumult or grief) kjv:--clamour, cry(-ing). see G2896,
G2907	κρέας	kréas	kreh'-as	perhaps a primary word; def: (butcher's) meat kjv:--flesh.
G2908	κρεῖσσον	kreîsson	krice'-son	neuter of an alternate form of G2909 ; def: (as noun) better, i.e. greater advantage kjv:--better. see G2909,
G2909	κρείττων	kreíttōn	krite'-tohn	comparative of a derivative of G2904 ; def: stronger, i.e. (figuratively) better, i.e. nobler kjv:--best, better. see G2904,
G2910	κρεμάννυμι	kremánnymi	krem-an'-noo-mee	a prolonged form of a primary verb; def: to hang kjv:--hang.
G2911	κρημνός	krēmnós	krame-nos'	from G2910 ; def: overhanging, i.e. a precipice kjv:--steep place. see G2910,
G2912	Κρής	Krḗs	krace	from G2914 ; def: a Cretan, i.e. inhabitant of Crete kjv:--Crete, Cretian. see G2914,
G2913	Κρήσκης	Krḗskēs	krace'-kace	of Latin origin; def: growing; Cresces (i.e. Crescens), a Christian kjv:--Crescens.
G2914	Κρήτη	Krḗtē	kray'-tay	of uncertain derivation; def: Crete, an island in the Mediterranean kjv:--Crete.
G2915	κριθή	krithḗ	kree-thay'	of uncertain derivation; def: barley kjv:--barley.
G2916	κρίθινος	kríthinos	kree'-thee-nos	from G2915 ; def: consisting of barley kjv:--barley. see G2915,
G2917	κρίμα	kríma	kree'-mah	from G2919 ; def: a decision (the function or the effect, for or against ("crime")) kjv:--avenge, condemned, condemnation, damnation, + go to law, judgment. see G2919,
G2918	κρίνον	krínon	kree'-non	perhaps a prim word; def: a lily kjv:--lily.
G2919	κρίνω	krínō	kree'-no	properly, to distinguish, i.e. decide (mentally or judicially); def: by implication, to try, condemn, punish kjv:--avenge, conclude, condemn, damn, decree, determine, esteem, judge, go to (sue at the) law, ordain, call in question, sentence to, think.
G2920	κρίσις	krísis	kree'-sis	def:decision (subjectively or objectively, for or against); by extension, a tribunal; by implication, justice (especially, divine law) kjv:--accusation, condemnation, damnation, judgment.
G2921	Κρίσπος	Kríspos	kris'-pos	of Latin origin; def: "crisp"; Crispus, a Corinthian kjv:--Crispus.
G2922	κριτήριον	kritḗrion	kree-tay'-ree-on	neuter of a presumed derivative of G2923 ; def: a rule of judging ("criterion"), i.e. (by implication) a tribunal kjv:--to judge, judgment (seat). see G2923,
G2923	κριτής	kritḗs	kree-tace'	from G2919 ; def: a judge (genitive case or specially) kjv:--judge. see G2919,
G2924	κριτικός	kritikós	krit-ee-kos'	from G2923 ; def: decisive ("critical"), i.e. discriminative kjv:--discerner. see G2923,
G2925	κρούω	kroúō	kroo'-o	apparently a primary verb; def: to rap kjv:--knock.
G2926	κρύπτη	krýptē	kroop-tay'	feminine of G2927 ; def: a hidden place, i.e. cellar ("crypt") kjv:--secret. see G2927,
G2927	κρυπτός	kryptós	kroop-tos'	from G2928 ; def: concealed, i.e. private kjv:--hid(-den), inward(-ly), secret. see G2928,
G2928	κρύπτω	krýptō	kroop'-to	a primary verb; def: to conceal (properly, by covering) kjv:--hide (self), keep secret, secret(-ly).
G2929	κρυσταλλίζω	krystallízō	kroos-tal-lid'-zo	from G2930 ; def: to make (i.e. intransitively, resemble) ice ("crystallize") kjv:--be clear as crystal. see G2930,
G2930	κρύσταλλος	krýstallos	kroos'-tal-los	from a derivative of (frost); def: ice, i.e. (by analogy) rock "crystal" kjv:--crystal.
G2931	κρυφῆ	kryphē	kroo-fay'	adverb from G2928 ; def: privately kjv:--in secret. see G2928,
G2932	κτάομαι	ktáomai	ktah'-om-ahee	a primary verb; def: to get, i.e. acquire (by any means; own) kjv:--obtain, possess, provide, purchase.
G2933	κτῆμα	ktēma	ktay'-mah	from G2932 ; def: an acquirement, i.e. estate kjv:--possession. see G2932,
G2934	κτῆνος	ktēnos	ktay'-nos	from G2932 ; def: property, i.e. (specially) a domestic animal kjv:--beast. see G2932,
G2935	κτήτωρ	ktḗtōr	ktay'-tore	from G2932 ; def: an owner kjv:--possessor. see G2932,
G2936	κτίζω	ktízō	ktid'-zo	probably akin to G2932 (through the idea of proprietorship of the manufacturer); def: to fabricate, i.e. found (form originally) kjv:--create, Creator, make. see G2932,
G2937	κτίσις	ktísis	ktis'-is	from G2936 ; def: original formation (properly, the act; by implication, the thing, literally or figuratively) kjv:--building, creation, creature, ordinance. see G2936,
G2938	κτίσμα	ktísma	ktis'-mah	from G2936 ; def: an original formation (concretely), i.e. product (created thing) kjv:--creature. see G2936,
G2939	κτίστης	ktístēs	ktis-tace'	from G2936 ; def: a founder, i.e. God (as author of all things) kjv:--Creator. see G2936,
G2940	κυβεία	kybeía	koo-bi'-ah	from (a "cube", i.e. die for playing); def: gambling, i.e. (figuratively) artifice or fraud kjv:--sleight.
G2941	κυβέρνησις	kybérnēsis	koo-ber'-nay-sis	from (of Latin origin, to steer); def: pilotage, i.e. (figuratively) directorship (in the church) kjv:--government.
G2942	κυβερνήτης	kybernḗtēs	koo-ber-nay'-tace	from the same as G2941 ; def: helmsman, i.e. (by implication) captain kjv:--(ship) master. see G2941,
G2943	κυκλόθεν	kyklóthen	koo-kloth'-en	adverb from the same as G2945 ; def: from the circle, i.e. all around kjv:--(round) about. see G2945,
G2944	κυκλόω	kyklóō	koo-klo'-o	from the same as G2945 ; def: to encircle, i.e. surround kjv:--compass (about), come (stand) round about. see G2945,
G2945	κύκλῳ	kýklōi	koo'-klo	as if dative case of (a ring, "cycle"; def: akin to kjv:--round about. see G2947, see G1722,
G2946	κύλισμα	kýlisma	koo'-lis-mah	from G2947 ; def: a wallow (the effect of rolling), i.e. filth kjv:--wallowing. see G2947,
G2947	κυλιόω	kylióō	koo-lee-o'-o	from the base of G2949 (through the idea of circularity; def: compare kjv:--wallow. see G2949, see G2945, see G1507,
G2948	κυλλός	kyllós	kool-los'	from the same as G2947 ; def: rocking about, i.e. crippled (maimed, in feet or hands) kjv:--maimed. see G2947,
G2949	κῦμα	kŷma	koo'-mah	from (to swell (with young), i.e. bend, curve); def: a billow (as bursting or toppling) kjv:--wave.
G2950	κύμβαλον	kýmbalon	koom'-bal-on	from a derivative of the base of G2949 ; def: a "cymbal" (as hollow) kjv:--cymbal. see G2949,
G2951	κύμινον	kýminon	koo'-min-on	of foreign origin (compare H03646 ); def: dill or fennel ("cummin") kjv:--cummin. see H03646,
G2952	κυνάριον	kynárion	koo-nar'-ee-on	neuter of a presumed derivative of G2965 ; def: a puppy kjv:--dog. see G2965,
G2953	Κύπριος	Kýprios	koo'-pree-os	from G2954 ; def: a Cyprian (Cypriot), i.e. inhabitant of Cyprus kjv:--of Cyprus. see G2954,
G2954	Κύπρος	Kýpros	koo'-pros	of uncertain origin; def: Cyprus, an island in the Mediterranean kjv:--Cyprus.
G2955	κύπτω	kýptō	koop'-to	probably from the base of G2949 ; def: to bend forward kjv:--stoop (down). see G2949,
G2956	Κυρηναῖος	Kyrēnaîos	koo-ray-nah'-yos	from G2957 ; def: i.e. Cyrenæan, i.e. inhabitant of Cyrene kjv:--of Cyrene, Cyrenian. see G2957,
G2957	Κυρήνη	Kyrḗnē	koo-ray'-nay	of uncertain derivation; def: Cyrene, a region of Africa kjv:--Cyrene.
G2958	Κυρήνιος	Kyrḗnios	koo-ray'-nee-os	of Latin origin; def: Cyrenius (i.e. Quirinus), a Roman kjv:--Cyrenius.
G2959	Κυρία	Kyría	koo-ree'-ah	feminine of G2962 ; def: Cyria, a Christian woman kjv:--lady. see G2962,
G2960	κυριακός	kyriakós	koo-ree-ak-os'	from G2962 ; def: belonging to the Lord (Jehovah or Jesus) kjv:--Lord's. see G2962,
G2961	κυριεύω	kyrieúō	ko-ree-yoo'-o	from G2962 ; def: to rule kjv:--have dominion over, lord, be lord of, exercise lordship over. see G2962,
G2962	κύριος	kýrios	koo'-ree-os	from (supremacy); def: supreme in authority, i.e. (as noun) controller; by implication, Master (as a respectful title) kjv:-- God, Lord, master, Sir.
G2963	κυριότης	kyriótēs	koo-ree-ot'-ace	from G2962 ; def: mastery, i.e. (concretely and collectively) rulers kjv:--dominion, government. see G2962,
G2964	κυρόω	kyróō	koo-ro'-o	from the same as G2962 ; def: to make authoritative, i.e. ratify kjv:--confirm. see G2962,
G2965	κύων	kýōn	koo'-ohn	a primary word; def: a dog ("hound") (literally or figuratively) kjv:--dog.
G2966	κῶλον	kōlon	ko'-lon	from the base of G2849 ; def: a limb of the body (as if lopped) kjv:--carcase. see G2849,
G2967	κωλύω	kōlýō	ko-loo'-o	from the base of G2849 ; def: to estop, i.e. prevent (by word or act) kjv:--forbid, hinder, keep from, let, not suffer, withstand. see G2849,
G2968	κώμη	kṓmē	ko'-may	from G2749 ; def: a hamlet (as if laid down) kjv:--town, village. see G2749,
G2969	κωμόπολις	kōmópolis	ko-mop'-ol-is	from G2968 and G4172 ; def: an unwalled city kjv:--town. see G2968, see G4172,
G2970	κῶμος	kōmos	ko'-mos	from G2749 ; def: a carousal (as if letting loose) kjv:--revelling, rioting. see G2749,
G2971	κώνωψ	kṓnōps	ko'-nopes	apparently a derivative of the base of G2759 and a derivative of G3700 ; def: a mosquito (from its stinging proboscis) kjv:--gnat. see G2759, see G3700,
G2972	Κώς	Kṓs	koce	of uncertain origin; def: Cos, an island in the Mediterranean kjv:--Cos.
G2973	Κωσάμ	Kōsám	ko-sam'	of Hebrew origin (compare H07081 ); def: Cosam (i.e. Kosam) an Israelite kjv:--Cosam. see H07081,
G2974	κωφός	kōphós	ko-fos'	from G2875 ; def: blunted, i.e. (figuratively) of hearing (deaf) or speech (dumb) kjv:--deaf, dumb, speechless. see G2875,
G2975	λαγχάνω	lanchánō	lang-khan'-o	a prolonged form of a primary verb, which is only used as an alternate in certain tenses; def: to lot, i.e. determine (by implication, receive) especially by lot kjv:--his lot be, cast lots, obtain.
G2976	Λάζαρος	Lázaros	lad'-zar-os	probably of Hebrew origin ( H0499 ); def: Lazarus (i.e. Elazar), the name of two Israelites (one imaginary) kjv:--Lazarus. see H0499,
G2977	λάθρα	láthra	lath'-rah	adverb from G2990 ; def: privately kjv:--privily, secretly. see G2990,
G2978	λαῖλαψ	laîlaps	lah'-ee-laps	of uncertain derivation; def: a whirlwind (squall) kjv:--storm, tempest.
G2979	λακτίζω	laktízō	lak-tid'-zo	from adverb (heelwise); def: to recalcitrate kjv:--kick.
G2980	λαλέω	laléō	lal-eh'-o	a prolonged form of an otherwise obsolete verb; def: to talk, i.e. utter words kjv:--preach, say, speak (after), talk, tell, utter. see G3004,
G2981	λαλιά	laliá	lal-ee-ah'	from G2980 ; def: talk kjv:--saying, speech. see G2980,
G2982	λαμμᾶ	lammâ	lam-ah'	of Hebrew origin ( H04100 with prepositional prefix); def: lama (i.e. why) kjv:--lama. see H04100,
G2983	λαμβάνω	lambánō	lam-ban'-o	a prolonged form of a primary verb, which is use only as an alternate in certain tenses; to take (in very many applications, literally and figuratively (properly objective or active, to get hold of; whereas G1209 is rather subjective or passive, to have offered to one; def: while kjv:--accept, + be amazed, assay, attain, bring, X when I call, catch, come on (X unto), + forget, have, hold, obtain, receive (X after), take (away, up). see G1209, see G138,
G2984	Λάμεχ	Lámech	lam'-ekh	of Hebrew origin ( H03929 ); def: Lamech (i.e. Lemek), a patriarch kjv:--Lamech. see H03929,
G2985	λαμπάς	lampás	lam-pas'	from G2989 ; def: a "lamp" or flambeau kjv:--lamp, light, torch. see G2989,
G2986	λαμπρός	lamprós	lam-pros'	from the same as G2985 ; def: radiant; by analogy, limpid; figuratively, magnificent or sumptuous (in appearance) kjv:--bright, clear, gay, goodly, gorgeous, white. see G2985,
G2987	λαμπρότης	lamprótēs	lam-prot'-ace	from G2986 ; def: brilliancy kjv:--brightness. see G2986,
G2988	λαμπρῶς	lamprōs	lam-proce'	adverb from G2986 ; def: brilliantly, i.e. figuratively, luxuriously kjv:--sumptuously. see G2986,
G2989	λάμπω	lámpō	lam'-po	a primary verb; def: to beam, i.e. radiate brilliancy (literally or figuratively) kjv:--give light, shine.
G2990	λανθάνω	lanthánō	lan-than'-o	a prolonged form of a primary verb, which is used only as an alternate in certain tenses; def: to lie hid (literally or figuratively); often used adverbially, unwittingly kjv:--be hid, be ignorant of, unawares.
G2991	λαξευτός	laxeutós	lax-yoo-tos'	from a compound of (a stone) and the base of G3584 (in its original sense of scraping); def: rock-quarried kjv:--hewn in stone. see G3584,
G2992	λαός	laós	lah-os'	apparently a primary word; def: a people (in general; thus differing from kjv:--people. see G1218,
G2993	Λαοδίκεια	Laodíkeia	lah-od-ik'-i-ah	from a compound of G2992 and G1349 ; def: Laodicia, a place in Asia Minor kjv:--Laodicea. see G2992, see G1349,
G2994	Λαοδικεύς	Laodikeús	lah-od-ik-yooce'	from G2993 ; def: a Laodicean, i.e. inhabitant of Laodicia kjv:--Laodicean. see G2993,
G2995	λάρυγξ	lárynx	lar'-oongks	of uncertain derivation; def: the throat ("larynx") kjv:--throat.
G2996	Λασαία	Lasaía	las-ah'-yah	of uncertain origin; def: Lasæa, a place in Crete kjv:--Lasea.
G2997	λάσχω	láschō	las'-kho	a strengthened form of a primary verb, which only occurs in this and another prolonged form as alternate in certain tenses; def: to crack open (from a fall) kjv:--burst asunder.
G2998	λατομέω	latoméō	lat-om-eh'-o	from the same as the first part of G2991 and the base of G5114 ; def: to quarry kjv:--hew. see G2991, see G5114,
G2999	λατρεία	latreía	lat-ri'-ah	from G3000 ; def: ministration of God, i.e. worship kjv:--(divine) service. see G3000,
G3000	λατρεύω	latreúō	lat-ryoo'-o	from (a hired menial); def: to minister (to God), i.e. render religious homage kjv:--serve, do the service, worship(-per).
G3001	λάχανον	láchanon	lakh'-an-on	from (to dig); def: a vegetable kjv:--herb.
G3002	Λεββαῖος	Lebbaîos	leb-bah'-yos	of uncertain origin; def: Lebbæus, a Christian kjv:--Lebbæus.
G3003	λεγεών	legeṓn	leg-eh-ohn'	of Latin origin; def: a "legion", i.e. Roman regiment (figuratively) kjv:--legion.
G3004	λέγω	légō	leg'-o	a primary verb; def: properly, to "lay" forth, i.e. (figuratively) relate (in words (usually of systematic or set discourse; whereas kjv:--ask, bid, boast, call, describe, give out, name, put forth, say(-ing, on), shew, speak, tell, utter. see G2036, see G5346, see G4483, see G2980,
G3005	λεῖμμα	leîmma	lime'-mah	from G3007 ; def: a remainder kjv:--remnant. see G3007,
G3006	λεῖος	leîos	li'-os	apparently a primary word; def: smooth, i.e. "level" kjv:--smooth.
G3007	λείπω	leípō	li'-po	a primary verb; def: to leave, i.e. (intransitively or passively) to fail or be absent kjv:--be destitute (wanting), lack.
G3008	λειτουργέω	leitourgéō	li-toorg-eh'-o	from G3011 ; def: to be a public servant, i.e. (by analogy) to perform religious or charitable functions (worship, obey, relieve) kjv:--minister. see G3011,
G3009	λειτουργία	leitourgía	li-toorg-ee'-ah	from G3008 ; def: public function (as priest ("liturgy") or almsgiver) kjv:--ministration(-try), service. see G3008,
G3010	λειτουργικός	leitourgikós	li-toorg-ik-os'	from the same as G3008 ; def: functional publicly ("liturgic"); i.e. beneficient kjv:--ministering. see G3008,
G3011	λειτουργός	leitourgós	li-toorg-os'	from a derivative of G2992 and G2041 ; def: a public servant, i.e. a functionary in the Temple or Gospel, or (genitive case) a worshipper (of God) or benefactor (of man) kjv:--minister(-ed). see G2992, see G2041,
G3012	λέντιον	léntion	len'-tee-on	of Latin origin; def: a "linen" cloth, i.e. apron kjv:--towel.
G3013	λεπίς	lepís	lep-is'	from (to peel); def: a flake kjv:--scale.
