id	unicode_word	translit	pronunciation	full_definition
G4168	ποίμνιον	poímnion	poym'-nee-on	neuter of a presumed derivative of G4167 ; def: a flock, i.e. (figuratively) group (of believers) kjv:--flock. see G4167,
G4169	ποῖος	poîos	poy'-os	from the base of G4226 and G3634 ; def: individualizing interrogative (of character) what sort of, or (of number) which one kjv:--what (manner of), which. see G4226, see G3634,
G4170	πολεμέω	poleméō	pol-em-eh'-o	from G4171 ; def: to be (engaged) in warfare, i.e. to battle (literally or figuratively) kjv:--fight, (make) war. see G4171,
G4171	πόλεμος	pólemos	pol'-em-os	from (to bustle); def: warfare (literally or figuratively; a single encounter or a series) kjv:--battle, fight, war.
G4172	πόλις	pólis	pol'-is	probably from the same as G4171 , or perhaps from G4183 ; def: a town (properly, with walls, of greater or less size) kjv:--city. see G4183, see G4171,
G4173	πολιτάρχης	politárchēs	pol-it-ar'-khace	from G4172 and G757 ; def: a town-officer, i.e. magistrate kjv:--ruler of the city. see G4172, see G757,
G4174	πολιτεία	politeía	pol-ee-ti'-ah	from G4177 ("polity"); def: citizenship; concretely, a community kjv:--commonwealth, freedom. see G4177,
G4175	πολίτευμα	políteuma	pol-it'-yoo-mah	from G4176 ; def: a community, i.e. (abstractly) citizenship (figuratively) kjv:--conversation. see G4176,
G4176	πολιτεύομαι	politeúomai	pol-it-yoo'-om-ahee	middle voice of a derivative of G4177 ; def: to behave as a citizen (figuratively) kjv:--let conversation be, live. see G4177,
G4177	πολίτης	polítēs	pol-ee'-tace	from G4172 ; def: a townsman kjv:--citizen. see G4172,
G4178	πολλάκις	pollákis	pol-lak'-is	multiplicative adverb from G4183 ; def: many times, i.e. frequently kjv:--oft(-en, -entimes, -times). see G4183,
G4179	πολλαπλασίων	pollaplasíōn	pol-lap-las-ee'-ohn	from G4183 and probably a derivative of G4120 ; def: manifold, i.e. (neuter as noun) very much more kjv:--manifold more. see G4183, see G4120,
G4180	πολυλογία	polylogía	pol-oo-log-ee'-ah	from a compound of G4183 and G3056 ; def: loquacity, i.e. prolixity kjv:--much speaking. see G4183, see G3056,
G4181	πολυμερῶς	polymerōs	pol-oo-mer'-oce	adverb from a compound of G4183 and G3313 ; def: in many portions, i.e. variously as to time and agency (piecemeal) kjv:--at sundry times. see G4183, see G3313,
G4182	πολυποίκιλος	polypoíkilos	pol-oo-poy'-kil-os	from G4183 and G4164 ; def: much variegated, i.e. multifarious kjv:--manifold. see G4183, see G4164,
G4183	πολύς	polýs	pol-oos'	including the forms from the alternate ; def: (singular) much (in any respect) or (plural) many; neuter (singular) as adverbial, largely; neuter (plural) as adverb or noun often, mostly, largely kjv:--abundant, + altogether, common, + far (passed, spent), (+ be of a) great (age, deal, -ly, while), long, many, much, oft(-en (-times)), plenteous, sore, straitly. see G4118, see G4119,
G4184	πολύσπλαγχνος	polýsplanchnos	pol-oo'-splankh-nos	from G4183 and G4698 (figuratively); def: extremely compassionate kjv:--very pitiful. see G4183, see G4698,
G4185	πολυτελής	polytelḗs	pol-oo-tel-ace'	from G4183 and G5056 ; def: extremely expensive kjv:--costly, very precious, of great price. see G4183, see G5056,
G4186	πολύτιμος	polýtimos	pol-oot'-ee-mos	from G4183 and G5092 ; def: extremely valuable kjv:--very costly, of great price. see G4183, see G5092,
G4187	πολυτρόπως	polytrópōs	pol-oot-rop'-oce	adverb from a compound of G4183 and G5158 ; def: in many ways, i.e. variously as to method or form kjv:--in divers manners. see G4183, see G5158,
G4188	πόμα	póma	pom'-ah	from the alternate of G4095 ; def: a beverage kjv:--drink. see G4095,
G4189	πονηρία	ponēría	pon-ay-ree'-ah	from G4190 ; def: depravity, i.e. (specially), malice; plural (concretely) plots, sins kjv:--iniquity, wickedness. see G4190,
G4190	πονηρός	ponērós	pon-ay-ros'	from a derivative of G4192 ; def: hurtful, i.e. evil (properly, in effect or influence, and thus differing from kjv:--bad, evil, grievous, harm, lewd, malicious, wicked(-ness). see G4192, see G2556, see G4550, see G4191,
G4191	πονηρότερος	ponēróteros	pon-ay-rot'-er-os	comparative of G4190 ; def: more evil kjv:--more wicked. see G4190,
G4192	πόνος	pónos	pon'-os	from the base of G3993 ; def: toil, i.e. (by implication) anguish kjv:--pain. see G3993,
G4193	Ποντικός	Pontikós	pon-tik-os'	from G4195 ; def: a Pontican, i.e. native of Pontus kjv:--born in Pontus. see G4195,
G4194	Πόντιος	Póntios	pon'-tee-os	of Latin origin; def: apparently bridged; Pontius, a Roman kjv:--Pontius.
G4195	Πόντος	Póntos	pon'-tos	of Latin origin; def: a sea; Pontus, a region of Asia Minor kjv:--Pontus.
G4196	Πόπλιος	Póplios	pop'-lee-os	of Latin origin; def: apparently "popular"; Poplius (i.e. Publius), a Roman kjv:--Publius.
G4197	πορεία	poreía	por-i'-ah	from G4198 ; def: travel (by land); figuratively (plural) proceedings, i.e. career kjv:--journey(-ing), ways. see G4198,
G4198	πορεύομαι	poreúomai	por-yoo'-om-ahee	middle voice from a derivative of the same as G3984 ; def: to traverse, i.e. travel (literally or figuratively; especially to remove (figuratively, die), live, etc.); kjv--depart, go (away, forth, one's way, up), (make a, take a) journey, walk. see G3984,
G4199	πορθέω	porthéō	por-theh'-o	prolongation from (to sack); def: to ravage (figuratively) kjv:--destroy, waste.
G4200	πορισμός	porismós	por-is-mos'	from a derivative of (a way, i.e. means); def: furnishing (procuring), i.e. (by implication) money-getting (acquisition) kjv:--gain.
G4201	Πόρκιος	Pórkios	por'-kee-os	of Latin origin; def: apparently swinish; Porcius, a Roman kjv:--Porcius.
G4202	πορνεία	porneía	por-ni'-ah	from G4203 ; def: harlotry (including adultery and incest); figuratively, idolatry kjv:--fornication. see G4203,
G4203	πορνεύω	porneúō	porn-yoo'-o	from G4204 ; def: to act the harlot, i.e. (literally) indulge unlawful lust (of either sex), or (figuratively) practise idolatry kjv:--commit (fornication). see G4204,
G4204	πόρνη	pórnē	por'-nay	feminine of G4205 ; def: a strumpet; figuratively, an idolater kjv:--harlot, whore. see G4205,
G4205	πόρνος	pórnos	por'-nos	from (to sell; def: akin to the base of kjv:--fornicator, whoremonger. see G4097,
G4206	πόῤῥω	pórrhō	por'-rho	adverb from G4253 ; def: forwards, i.e. at a distance kjv:--far, a great way off. see G4253, see G4207,
G4207	πόῤῥωθεν	pórrhōthen	por'-rho-then	from G4206 with adverbial enclitic of source; def: from far, or (by implication) at a distance, i.e. distantly kjv:--afar off. see G4206,
G4208	ποῤῥωτέρω	porrhōtérō	por-rho-ter'-o	adverb comparative of G4206 ; def: further, i.e. a greater distance kjv:--farther. see G4206,
G4209	πορφύρα	porphýra	por-foo'-rah	of Latin origin; def: the "purple" mussel, i.e. (by implication) the red-blue color itself, and finally a garment dyed with it kjv:--purple.
G4210	πορφυροῦς	porphyroûs	por-foo-rooce'	from G4209 ; def: purpureal, i.e. bluish red kjv:--purple. see G4209,
G4211	πορφυρόπωλις	porphyrópōlis	por-foo-rop'-o-lis	feminine of a compound of G4209 and G4453 ; def: a female trader in purple cloth kjv:--seller of purple. see G4209, see G4453,
G4212	ποσάκις	posákis	pos-ak'-is	multiplicative from G4214 ; def: how many times kjv:--how oft(-en). see G4214,
G4213	πόσις	pósis	pos'-is	from the alternate of G4095 ; def: a drinking (the act), i.e. (concretely) a draught kjv:--drink. see G4095,
G4214	πόσος	pósos	pos'-os	from an absolute (who, what) and G3739 ; def: interrogative pronoun (of amount) how much (large, long or (plural) many) kjv:--how great (long, many), what. see G3739,
G4215	ποταμός	potamós	pot-am-os'	probably from a derivative of the alternate of G4095 (compare G4224 ); def: a current, brook or freshet (as drinkable), i.e. running water kjv:--flood, river, stream, water. see G4095, see G4224,
G4216	ποταμοφόρητος	potamophórētos	pot-am-of-or'-ay-tos	from G4215 and a derivative of G5409 ; def: river-borne, i.e. overwhelmed by a stream kjv:--carried away of the flood. see G4215, see G5409,
G4217	ποταπός	potapós	pot-ap-os'	apparently from G4219 and the base of G4226 ; def: interrogatively, whatever, i.e. of what possible sort kjv:--what (manner of). see G4219, see G4226,
G4218	ποτέ	poté	pot-eh'	from the base of G4225 and G5037 ; def: indefinite adverb, at some time, ever kjv:--afore-(any, some-)time(-s), at length (the last), (+ n- )ever, in the old time, in time past, once, when. see G4225, see G5037,
G4219	πότε	póte	pot'-eh	from the base of G4226 and G5037 ; def: interrogative adverb, at what time kjv:--+ how long, when. see G4226, see G5037,
G4220	πότερον	póteron	pot'-er-on	neuter of a comparative of the base of G4226 ; def: interrogative as adverb, which (of two), i.e. is it this or that kjv:--whether. see G4226,
G4221	ποτήριον	potḗrion	pot-ay'-ree-on	neuter of a derivative of the alternate of G4095 ; def: a drinking-vessel; by extension, the contents thereof, i.e. a cupful (draught); figuratively, a lot or fate kjv:--cup. see G4095,
G4222	ποτίζω	potízō	pot-id'-zo	from a derivative of the alternate of G4095 ; def: to furnish drink, irrigate kjv:--give (make) to drink, feed, water. see G4095,
G4223	Ποτίολοι	Potíoloi	pot-ee'-ol-oy	of Latin origin; def: little wells, i.e. mineral springs; Potioli (i.e. Puteoli), a place in Italy kjv:--Puteoli.
G4224	πότος	pótos	pot'-os	from the alternate of G4095 ; def: a drinking-bout or carousal kjv:--banqueting. see G4095,
G4225	πού	poú	poo	genitive case of an indefinite pronoun (some) otherwise obsolete (compare G4214 ); def: as adverb of place, somewhere, i.e. nearly kjv:--about, a certain place. see G4214,
G4226	ποῦ	poû	poo	genitive case of an interrogative pronoun (what) otherwise obsolete (perhaps the same as G4225 used with the rising slide of inquiry); def: as adverb of place; at (by implication, to) what locality kjv:--where, whither. see G4225,
G4227	Πούδης	Poúdēs	poo'-dace	of Latin origin; def: modest; Pudes (i.e. Pudens), a Christian kjv:--Pudens.
G4228	πούς	poús	pooce	a primary word; def: a "foot" (figuratively or literally) kjv:--foot(-stool).
G4229	πρᾶγμα	prâgma	prag'-mah	from G4238 ; def: a deed; by implication, an affair; by extension, an object (material) kjv:--business, matter, thing, work. see G4238,
G4230	πραγματεία	pragmateía	prag-mat-i'-ah	from G4231 ; def: a transaction, i.e. negotiation kjv:--affair. see G4231,
G4231	πραγματεύομαι	pragmateúomai	prag-mat-yoo'-om-ahee	from G4229 ; def: to busy oneself with, i.e. to trade kjv:--occupy. see G4229,
G4232	πραιτώριον	praitṓrion	prahee-to'-ree-on	of Latin origin; def: the prætorium or governor's courtroom (sometimes including the whole edifice and camp) kjv:--(common, judgment) hall (of judgment), palace, prætorium.
G4233	πράκτωρ	práktōr	prak'-tor	from a derivative of G4238 ; def: a practiser, i.e. (specially), an official collector kjv:--officer. see G4238,
G4234	πρᾶξις	prâxis	prax'-is	from G4238 ; def: practice, i.e. (concretely) an act; by extension, a function kjv:--deed, office, work. see G4238,
G4235	πρᾷος	prâios	prah'-os	a form of G4239 , used in certain parts; def: gentle, i.e. humble kjv:--meek. see G4239,
G4236	πρᾳότης	praiótēs	prah-ot'-ace	from G4235 ; def: gentleness, by implication, humility kjv:--meekness. see G4235,
G4237	πρασιά	prasiá	pras-ee-ah'	perhaps from (a leek, and so an onion-patch); def: a garden plot, i.e. (by implication, of regular beds) a row (repeated in plural by Hebraism, to indicate an arrangement) kjv:--in ranks.
G4238	πράσσω	prássō	pras'-so	a primary verb; def: to "practise", i.e. perform repeatedly or habitually (thus differing from kjv:--commit, deeds, do, exact, keep, require, use arts. see G4160,
G4239	πραΰς	praÿs	prah-ooce'	apparently a primary word; def: mild, i.e. (by implication) humble kjv:--meek. see G4235,
G4240	πραΰτης	praÿtēs	prah-oo'-tace	from G4239 ; def: mildness, i.e. (by implication) humility kjv:--meekness. see G4239,
G4241	πρέπω	prépō	prep'-o	apparently a primary verb; def: to tower up (be conspicuous), i.e. (by implication) to be suitable or proper (third person singular present indicative, often used impersonally, it is fit or right) kjv:--become, comely.
G4242	πρεσβεία	presbeía	pres-bi'-ah	from G4243 ; def: seniority (eldership), i.e. (by implication) an embassy (concretely, ambassadors) kjv:--ambassage, message. see G4243,
G4243	πρεσβεύω	presbeúō	pres-byoo'-o	from the base of G4245 ; def: to be a senior, i.e. (by implication) act as a representative (figuratively, preacher) kjv:--be an ambassador. see G4245,
G4244	πρεσβυτέριον	presbytérion	pres-boo-ter'-ee-on	neuter of a presumed derivative of G4245 ; def: the order of elders, i.e. (specially), Israelite Sanhedrin or Christian "presbytery" kjv:--(estate of) elder(-s), presbytery. see G4245,
G4245	πρεσβύτερος	presbýteros	pres-boo'-ter-os	comparative of (elderly); def: older; as noun, a senior; specially, an Israelite Sanhedrist (also figuratively, member of the celestial council) or Christian "presbyter" kjv:-- elder(-est), old.
G4246	πρεσβύτης	presbýtēs	pres-boo'-tace	from the same as G4245 ; def: an old man kjv:--aged (man), old man. see G4245,
G4247	πρεσβῦτις	presbŷtis	pres-boo'-tis	feminine of G4246 ; def: an old woman kjv:--aged woman. see G4246,
G4248	πρηνής	prēnḗs	pray-nace'	from G4253 ; def: leaning (falling) forward ("prone"), i.e. head foremost kjv:--headlong. see G4253,
G4249	πρίζω	prízō	prid'-zo	a strengthened form of a primary prio (to saw); def: to saw in two kjv:--saw asunder.
G4250	πρίν	prín	prin	adverb from G4253 ; def: prior, sooner kjv:--before (that), ere. see G4253,
G4251	Πρίσκα	Príska	pris'-kah	of Latin origin; def: feminine of Priscus, ancient; Priska, a Christian woman kjv:--Prisca. see G4252,
G4252	Πρίσκιλλα	Prískilla	pris'-cil-lah	diminutive of G4251 ; def: Priscilla (i.e. little Prisca), a Christian woman kjv:--Priscilla. see G4251,
G4253	πρό	pró	pro	a primary preposition; def: "fore", i.e. in front of, prior (figuratively, superior) to kjv:--above, ago, before, or ever.
G4254	προάγω	proágō	pro-ag'-o	from G4253 and G71 ; def: to lead forward (magisterially); intransitively, to precede (in place or time (participle, previous)) kjv:--bring (forth, out), go before. see G4253, see G71,
G4255	προαιρέομαι	proairéomai	pro-ahee-reh'-om-ahee	from G4253 and G138 ; def: to choose for oneself before another thing (prefer), i.e. (by implication) to propose (intend) kjv:--purpose. see G4253, see G138,
G4256	προαιτιάομαι	proaitiáomai	pro-ahee-tee-ah'-om-ahee	from G4253 and a derivative of G156 ; def: to accuse already, i.e. previously charge kjv:--prove before. see G4253, see G156,
G4257	προακούω	proakoúō	pro-ak-oo'-o	from G4253 and G191 ; def: to hear already,i.e. anticipate kjv:--hear before. see G4253, see G191,
G4258	προαμαρτάνω	proamartánō	pro-am-ar-tan'-o	from G4253 and G264 ; def: to sin previously (to conversion) kjv:--sin already, heretofore sin. see G4253, see G264,
G4259	προαύλιον	proaúlion	pro-ow'-lee-on	neuter of a presumed compound of G4253 and G833 ; def: a forecourt, i.e. vestibule (alley-way) kjv:--porch. see G4253, see G833,
G4260	προβαίνω	probaínō	prob-ah'-ee-no	from G4253 and the base of G939 ; def: to walk forward, i.e. advance (literally, or in years) kjv:--+ be of a great age, go farther (on), be well stricken. see G4253, see G939,
G4261	προβάλλω	probállō	prob-al'-lo	from G4253 and G906 ; def: to throw forward, i.e. push to the front, germinate kjv:--put forward, shoot forth. see G4253, see G906,
G4262	προβατικός	probatikós	prob-at-ik-os'	from G4263 ; def: relating to sheep, i.e. (a gate) through which they were led into Jerusalem kjv:--sheep (market). see G4263,
G4263	πρόβατον	próbaton	prob'-at-on	probably neuter of a presumed derivative of G4260 ; def: something that walks forward (a quadruped), i.e. (specially), a sheep (literally or figuratively) kjv:--sheep(-fold). see G4260,
G4264	προβιβάζω	probibázō	prob-ib-ad'-zo	from G4253 and a reduplicated form of G971 ; def: to force forward, i.e. bring to the front, instigate kjv:--draw, before instruct. see G4253, see G971,
G4265	προβλέπω	problépō	prob-lep'-o	from G4253 and G991 ; def: to look out beforehand, i.e. furnish in advance kjv:--provide. see G4253, see G991,
G4266	προγίνομαι	progínomai	prog-in'-om-ahee	from G4253 and G1096 ; def: to be already, i.e. have previousy transpired kjv:--be past. see G4253, see G1096,
G4267	προγινώσκω	proginṓskō	prog-in-oce'-ko	from G4253 and G1097 ; def: to know beforehand, i.e. foresee kjv:--foreknow (ordain), know (before). see G4253, see G1097,
G4268	πρόγνωσις	prógnōsis	prog'-no-sis	from G4267 ; def: forethought kjv:--foreknowledge. see G4267,
G4269	πρόγονος	prógonos	prog'-on-os	from G4266 ; def: an ancestor, (grand-)parent kjv:--forefather, parent. see G4266,
G4270	προγράφω	prográphō	prog-raf'-o	from G4253 and G1125 ; def: to write previously; figuratively, to announce, prescribe kjv:--before ordain, evidently set forth, write (afore, aforetime). see G4253, see G1125,
G4271	πρόδηλος	pródēlos	prod'-ay-los	from G4253 and G1212 ; def: plain before all men, i.e. obvious kjv:--evident, manifest (open) beforehand. see G4253, see G1212,
G4272	προδίδωμι	prodídōmi	prod-id'-o-mee	from G4253 and G1325 ; def: to give before the other party has given kjv:--first give. see G4253, see G1325,
G4273	προδότης	prodótēs	prod-ot'-ace	from G4272 (in the sense of giving forward into another's (the enemy's) hands); def: a surrender kjv:--betrayer, traitor. see G4272,
G4274	πρόδρομος	pródromos	prod'-rom-os	from the alternate of G4390 ; def: a runner ahead, i.e. scout (figuratively, precursor) kjv:--forerunner. see G4390,
G4275	προείδω	proeídō	pro-i'-do	from G4253 and G1492 ; def: foresee kjv:--foresee, saw before. see G1492, see G4253,
G4276	προελπίζω	proelpízō	pro-el-pid'-zo	from G4253 and G1679 ; def: to hope in advance of other confirmation kjv:--first trust. see G4253, see G1679,
G4277	προέπω	proépō	pro-ep'-o	from G4253 and G2036 ; def: to say already, to predict kjv:--forewarn, say (speak, tell) before. see G4253, see G2036, see G4280,
G4278	προενάρχομαι	proenárchomai	pro-en-ar'-khom-ahee	from G4253 and G1728 ; def: to commence already kjv:--begin (before). see G4253, see G1728,
G4279	προεπαγγέλλομαι	proepangéllomai	pro-ep-ang-ghel'-lom-ahee	middle voice from G4253 and G1861 ; def: to promise of old kjv:--promise before. see G4253, see G1861,
G4280	προερέω	proeréō	pro-er-eh'-o	from G4253 and G2046 ; def: used as alternate of kjv:--foretell, say (speak, tell) before. see G4253, see G2046, see G4277,
G4281	προέρχομαι	proérchomai	pro-er'-khom-ahee	from G4253 and G2064 (including its alternate); def: to go onward, precede (in place or time) kjv:--go before (farther, forward), outgo, pass on. see G4253, see G2064,
G4282	προετοιμάζω	proetoimázō	pro-et-oy-mad'-zo	from G4253 and G2090 ; def: to fit up in advance (literally or figuratively) kjv:--ordain before, prepare afore. see G4253, see G2090,
G4283	προευαγγελίζομαι	proeuangelízomai	pro-yoo-ang-ghel-id'-zom-ahee	middle voice from G4253 and G2097 ; def: to announce glad news in advance kjv:--preach before the gospel. see G4253, see G2097,
G4284	προέχομαι	proéchomai	pro-ekh-om-ahee	middle voice from G4253 and G2192 ; def: to hold oneself before others, i.e. (figuratively) to excel kjv:--be better. see G4253, see G2192,
G4285	προηγέομαι	proēgéomai	pro-ay-geh'-om-ahee	from G4253 and G2233 ; def: to lead the way for others, i.e. show deference kjv:--prefer. see G4253, see G2233,
G4286	πρόθεσις	próthesis	proth'-es-is	from G4388 ; def: a setting forth, i.e. (figuratively) proposal (intention); specially, the show-bread (in the Temple) as exposed before God kjv:--purpose, shew(-bread). see G4388,
G4287	προθέσμιος	prothésmios	proth-es'-mee-os	from G4253 and a derivative of G5087 ; def: fixed beforehand, i.e. (feminine with kjv:--time appointed. see G4253, see G5087, see G2250,
G4288	προθυμία	prothymía	proth-oo-mee'-ah	from G4289 ; def: predisposition, i.e. alacrity kjv:--forwardness of mind, readiness (of mind), ready (willing) mind. see G4289,
G4289	πρόθυμος	próthymos	proth'-oo-mos	from G4253 and G2372 ; def: forward in spirit, i.e. predisposed; neuter (as noun) alacrity kjv:--ready, willing. see G4253, see G2372,
G4290	προθύμως	prothýmōs	proth-oo'-moce	adverb from G4289 ; def: with alacrity kjv:--willingly. see G4289,
G4291	προΐστημι	proḯstēmi	pro-is'-tay-mee	from G4253 and G2476 ; def: to stand before, i.e. (in rank) to preside, or (by implication) to practise kjv:--maintain, be over, rule. see G4253, see G2476,
G4292	προκαλέομαι	prokaléomai	prok-al-eh'-om-ahee	middle voice from G4253 and G2564 ; def: to call forth to oneself (challenge), i.e. (by implication) to irritate kjv:--provoke. see G4253, see G2564,
G4293	προκαταγγέλλω	prokatangéllō	prok-at-ang-ghel'-lo	from G4253 and G2605 ; def: to anounce beforehand, i.e. predict, promise kjv:--foretell, have notice, (shew) before. see G4253, see G2605,
G4294	προκαταρτίζω	prokatartízō	prok-at-ar-tid'-zo	from G4253 and G2675 ; def: to prepare in advance kjv:--make up beforehand. see G4253, see G2675,
G4295	πρόκειμαι	prókeimai	prok'-i-mahee	from G4253 and G2749 ; def: to lie before the view, i.e. (figuratively) to be present (to the mind), to stand forth (as an example or reward) kjv:--be first, set before (forth). see G4253, see G2749,
G4296	προκηρύσσω	prokērýssō	prok-ay-rooce'-so	from G4253 and G2784 ; def: to herald (i.e. proclaim) in advance kjv:--before (first) preach. see G4253, see G2784,
G4297	προκοπή	prokopḗ	prok-op-ay'	from G4298 ; def: progress, i.e. advancement (subjectively or objectively) kjv:--furtherance, profit. see G4298,
G4298	προκόπτω	prokóptō	prok-op'-to	from G4253 and G2875 ; def: to drive forward (as if by beating), i.e. (figuratively and intransitively) to advance (in amount, to grow; in time, to be well along) kjv:--increase, proceed, profit, be far spent, wax. see G4253, see G2875,
G4299	πρόκριμα	prókrima	prok'-ree-mah	from a compound of G4253 and G2919 ; def: a prejudgment (prejudice), i.e. prepossession kjv:--prefer one before another. see G4253, see G2919,
G4300	προκυρόω	prokyróō	prok-oo-ro'-o	from G4253 and G2964 ; def: to ratify previously kjv:--confirm before. see G4253, see G2964,
G4301	προλαμβάνω	prolambánō	prol-am-ban'-o	from G4253 and G2983 ; def: to take in advance, i.e. (literally) eat before others have an opportunity; (figuratively) to anticipate, surprise kjv:--come aforehand, overtake, take before. see G4253, see G2983,
G4302	προλέγω	prolégō	prol-eg'-o	from G4253 and G3004 ; def: to say beforehand, i.e. predict, forewarn kjv:--foretell, tell before. see G4253, see G3004,
G4303	προμαρτύρομαι	promartýromai	prom-ar-too'-rom-ahee	from G4253 and G3143 ; def: to be a witness in advance i.e. predict kjv:--testify beforehand. see G4253, see G3143,
G4304	προμελετάω	promeletáō	prom-el-et-ah'-o	from G4253 and G3191 ; def: to premeditate kjv:--meditate before. see G4253, see G3191,
G4305	προμεριμνάω	promerimnáō	prom-er-im-nah'-o	from G4253 and G3309 ; def: to care (anxiously) in advance kjv:--take thought beforehand. see G4253, see G3309,
G4306	προνοέω	pronoéō	pron-o-eh'-o	from G4253 and G3539 ; def: to consider in advance, i.e. look out for beforehand (actively, by way of maintenance for others; middle voice by way of circumspection for oneself) kjv:--provide (for). see G4253, see G3539,
G4307	πρόνοια	prónoia	pron'-oy-ah	from G4306 ; def: forethought, i.e. provident care or supply kjv:--providence, provision. see G4306,
G4308	προοράω	prooráō	pro-or-ah'-o	from G4253 and G3708 ; def: to behold in advance, i.e. (actively) to notice (another) previously, or (middle voice) to keep in (one's own) view kjv:--foresee, see before. see G4253, see G3708,
G4309	προορίζω	proorízō	pro-or-id'-zo	from G4253 and G3724 ; def: to limit in advance, i.e. (figuratively) predetermine kjv:--determine before, ordain, predestinate. see G4253, see G3724,
G4310	προπάσχω	propáschō	prop-as'-kho	from G4253 and G3958 ; def: to undergo hardship previously kjv:--suffer before. see G4253, see G3958,
G4311	προπέμπω	propémpō	prop-em'-po	from G4253 and G3992 ; def: to send forward, i.e. escort or aid in travel kjv:--accompany, bring (forward) on journey (way), conduct forth. see G4253, see G3992,
G4312	προπετής	propetḗs	prop-et-ace'	from a compound of G4253 and G4098 ; def: falling forward, i.e. headlong (figuratively, precipitate) kjv:--heady, rash(-ly). see G4253, see G4098,
G4313	προπορεύομαι	proporeúomai	prop-or-yoo'-om-ahee	from G4253 and G4198 ; def: to precede (as guide or herald) kjv:--go before. see G4253, see G4198,
